{
  "schema_version": "0.1",
  "task_id": "BENCH-SAMPLE-001",
  "recorded_at": "2026-08-11T12:10:00.000Z",
  "arm": "B",
  "input_tokens": 7000,
  "output_tokens": 2400,
  "tool_calls": 11,
  "file_reads": 9,
  "duration_ms": 150000,
  "test_status": "PASS",
  "review_status": "PASS",
  "completion_status": "PASS",
  "rework_count": 0
}
