{
  "schema_version": "0.1",
  "task_id": "BENCH-SAMPLE-001",
  "recorded_at": "2026-08-11T12:00:00.000Z",
  "arm": "A",
  "input_tokens": 10000,
  "output_tokens": 2500,
  "tool_calls": 18,
  "file_reads": 22,
  "duration_ms": 180000,
  "test_status": "PASS",
  "review_status": "PASS",
  "rework_count": 1
}
